[
  {
    "entity_id": "issue_62903",
    "entity_type": "Issue",
    "created_at": "2026-03-05T02:16:56Z",
    "last_seen_at": "2026-03-05T02:19:20Z",
    "entity_version": "1.0",
    "aliases": []
  },
  {
    "entity_id": "person_davidjfrickert",
    "entity_type": "Person",
    "created_at": "2026-03-05T02:16:56Z",
    "last_seen_at": "2026-03-05T02:16:56Z",
    "entity_version": "1.0",
    "aliases": []
  },
  {
    "entity_id": "status_open",
    "entity_type": "Status",
    "created_at": "2026-02-10T17:44:38Z",
    "last_seen_at": "2026-03-05T07:02:22Z",
    "entity_version": "1.0",
    "aliases": []
  },
  {
    "entity_id": "label_kind_bug",
    "entity_type": "Label",
    "created_at": "2026-02-10T10:34:56Z",
    "last_seen_at": "2026-03-05T02:16:56Z",
    "entity_version": "1.0",
    "aliases": []
  },
  {
    "entity_id": "label_area_providers",
    "entity_type": "Label",
    "created_at": "2026-02-10T14:03:53Z",
    "last_seen_at": "2026-03-05T02:16:56Z",
    "entity_version": "1.0",
    "aliases": []
  },
  {
    "entity_id": "label_area_auth",
    "entity_type": "Label",
    "created_at": "2026-02-10T10:34:56Z",
    "last_seen_at": "2026-03-05T02:16:56Z",
    "entity_version": "1.0",
    "aliases": []
  },
  {
    "entity_id": "label_kind_needs_triage",
    "entity_type": "Label",
    "created_at": "2026-02-10T10:34:56Z",
    "last_seen_at": "2026-03-05T02:16:56Z",
    "entity_version": "1.0",
    "aliases": []
  },
  {
    "entity_id": "label_kind_provider_fab",
    "entity_type": "Label",
    "created_at": "2026-02-16T15:33:36Z",
    "last_seen_at": "2026-03-05T02:16:56Z",
    "entity_version": "1.0",
    "aliases": []
  },
  {
    "entity_id": "issue_62887",
    "entity_type": "Issue",
    "created_at": "2026-03-04T18:49:29Z",
    "last_seen_at": "2026-03-04T19:03:56Z",
    "entity_version": "1.0",
    "aliases": []
  },
  {
    "entity_id": "person_ferruzzi",
    "entity_type": "Person",
    "created_at": "2026-03-04T18:49:29Z",
    "last_seen_at": "2026-03-04T18:49:29Z",
    "entity_version": "1.0",
    "aliases": []
  },
  {
    "entity_id": "label_kind_provider_amazon",
    "entity_type": "Label",
    "created_at": "2026-02-10T10:34:56Z",
    "last_seen_at": "2026-03-04T18:49:29Z",
    "entity_version": "1.0",
    "aliases": []
  },
  {
    "entity_id": "label_kind_feature",
    "entity_type": "Label",
    "created_at": "2026-02-10T14:03:53Z",
    "last_seen_at": "2026-03-04T18:49:29Z",
    "entity_version": "1.0",
    "aliases": []
  },
  {
    "entity_id": "label_kind_meta",
    "entity_type": "Label",
    "created_at": "2026-02-10T14:03:53Z",
    "last_seen_at": "2026-03-04T18:49:29Z",
    "entity_version": "1.0",
    "aliases": []
  },
  {
    "entity_id": "label_kind_provider_cncf_kubernetes",
    "entity_type": "Label",
    "created_at": "2026-02-10T15:19:19Z",
    "last_seen_at": "2026-03-04T18:49:29Z",
    "entity_version": "1.0",
    "aliases": []
  },
  {
    "entity_id": "issue_62881",
    "entity_type": "Issue",
    "created_at": "2026-03-04T16:29:25Z",
    "last_seen_at": "2026-03-05T02:02:01Z",
    "entity_version": "1.0",
    "aliases": []
  },
  {
    "entity_id": "person_andreahlert",
    "entity_type": "Person",
    "created_at": "2026-03-04T16:29:25Z",
    "last_seen_at": "2026-03-04T16:29:25Z",
    "entity_version": "1.0",
    "aliases": []
  },
  {
    "entity_id": "label_area_dev_env",
    "entity_type": "Label",
    "created_at": "2026-02-21T06:37:31Z",
    "last_seen_at": "2026-03-04T16:29:25Z",
    "entity_version": "1.0",
    "aliases": []
  },
  {
    "entity_id": "issue_62876",
    "entity_type": "Issue",
    "created_at": "2026-03-04T14:41:41Z",
    "last_seen_at": "2026-03-04T16:55:45Z",
    "entity_version": "1.0",
    "aliases": []
  },
  {
    "entity_id": "person_slloyd09",
    "entity_type": "Person",
    "created_at": "2026-03-04T14:41:41Z",
    "last_seen_at": "2026-03-04T14:41:41Z",
    "entity_version": "1.0",
    "aliases": []
  },
  {
    "entity_id": "label_area_api",
    "entity_type": "Label",
    "created_at": "2026-02-11T06:28:34Z",
    "last_seen_at": "2026-03-04T14:41:41Z",
    "entity_version": "1.0",
    "aliases": []
  },
  {
    "entity_id": "label_area_core",
    "entity_type": "Label",
    "created_at": "2026-02-10T14:55:14Z",
    "last_seen_at": "2026-03-04T14:41:41Z",
    "entity_version": "1.0",
    "aliases": []
  },
  {
    "entity_id": "issue_62875",
    "entity_type": "Issue",
    "created_at": "2026-03-04T14:09:43Z",
    "last_seen_at": "2026-03-04T14:12:03Z",
    "entity_version": "1.0",
    "aliases": []
  },
  {
    "entity_id": "person_kimminw00",
    "entity_type": "Person",
    "created_at": "2026-03-04T14:09:43Z",
    "last_seen_at": "2026-03-04T14:09:43Z",
    "entity_version": "1.0",
    "aliases": []
  },
  {
    "entity_id": "label_area_helm_chart",
    "entity_type": "Label",
    "created_at": "2026-02-18T21:16:27Z",
    "last_seen_at": "2026-03-04T14:09:43Z",
    "entity_version": "1.0",
    "aliases": []
  },
  {
    "entity_id": "issue_62874",
    "entity_type": "Issue",
    "created_at": "2026-03-04T13:55:13Z",
    "last_seen_at": "2026-03-04T21:40:52Z",
    "entity_version": "1.0",
    "aliases": []
  },
  {
    "entity_id": "person_devgonvarun",
    "entity_type": "Person",
    "created_at": "2026-03-02T11:01:47Z",
    "last_seen_at": "2026-03-04T13:55:13Z",
    "entity_version": "1.0",
    "aliases": []
  },
  {
    "entity_id": "issue_62872",
    "entity_type": "Issue",
    "created_at": "2026-03-04T13:45:29Z",
    "last_seen_at": "2026-03-04T13:47:56Z",
    "entity_version": "1.0",
    "aliases": []
  },
  {
    "entity_id": "person_kaxil",
    "entity_type": "Person",
    "created_at": "2026-03-02T20:52:27Z",
    "last_seen_at": "2026-03-04T13:45:29Z",
    "entity_version": "1.0",
    "aliases": []
  },
  {
    "entity_id": "issue_62845",
    "entity_type": "Issue",
    "created_at": "2026-03-04T05:24:14Z",
    "last_seen_at": "2026-03-05T04:23:21Z",
    "entity_version": "1.0",
    "aliases": []
  },
  {
    "entity_id": "person_ronak_sirwani",
    "entity_type": "Person",
    "created_at": "2026-03-04T05:24:14Z",
    "last_seen_at": "2026-03-05T04:23:21Z",
    "entity_version": "1.0",
    "aliases": []
  },
  {
    "entity_id": "status_closed",
    "entity_type": "Status",
    "created_at": "2026-02-10T14:55:58Z",
    "last_seen_at": "2026-03-05T06:13:39Z",
    "entity_version": "1.0",
    "aliases": []
  },
  {
    "entity_id": "label_kind_pending_response",
    "entity_type": "Label",
    "created_at": "2026-02-20T11:51:29Z",
    "last_seen_at": "2026-03-04T05:24:14Z",
    "entity_version": "1.0",
    "aliases": []
  },
  {
    "entity_id": "label_area_async_operators",
    "entity_type": "Label",
    "created_at": "2026-03-04T05:24:14Z",
    "last_seen_at": "2026-03-04T05:24:14Z",
    "entity_version": "1.0",
    "aliases": []
  },
  {
    "entity_id": "issue_62828",
    "entity_type": "Issue",
    "created_at": "2026-03-03T22:27:14Z",
    "last_seen_at": "2026-03-03T23:29:06Z",
    "entity_version": "1.0",
    "aliases": []
  },
  {
    "entity_id": "person_manoharraoutah",
    "entity_type": "Person",
    "created_at": "2026-03-03T22:27:14Z",
    "last_seen_at": "2026-03-03T22:27:14Z",
    "entity_version": "1.0",
    "aliases": []
  },
  {
    "entity_id": "issue_62826",
    "entity_type": "Issue",
    "created_at": "2026-03-03T21:57:59Z",
    "last_seen_at": "2026-03-04T12:52:51Z",
    "entity_version": "1.0",
    "aliases": []
  },
  {
    "entity_id": "issue_62799",
    "entity_type": "Issue",
    "created_at": "2026-03-03T16:35:33Z",
    "last_seen_at": "2026-03-04T19:51:22Z",
    "entity_version": "1.0",
    "aliases": []
  },
  {
    "entity_id": "person_prajwal7842",
    "entity_type": "Person",
    "created_at": "2026-03-03T16:35:33Z",
    "last_seen_at": "2026-03-04T08:23:39Z",
    "entity_version": "1.0",
    "aliases": []
  },
  {
    "entity_id": "label_area_ui",
    "entity_type": "Label",
    "created_at": "2026-02-12T15:25:06Z",
    "last_seen_at": "2026-03-03T16:35:33Z",
    "entity_version": "1.0",
    "aliases": []
  },
  {
    "entity_id": "issue_62794",
    "entity_type": "Issue",
    "created_at": "2026-03-03T15:57:57Z",
    "last_seen_at": "2026-03-04T17:00:17Z",
    "entity_version": "1.0",
    "aliases": []
  },
  {
    "entity_id": "person_potiuk",
    "entity_type": "Person",
    "created_at": "2026-02-14T14:45:31Z",
    "last_seen_at": "2026-03-04T04:53:55Z",
    "entity_version": "1.0",
    "aliases": []
  },
  {
    "entity_id": "issue_62789",
    "entity_type": "Issue",
    "created_at": "2026-03-03T14:39:44Z",
    "last_seen_at": "2026-03-03T14:42:04Z",
    "entity_version": "1.0",
    "aliases": []
  },
  {
    "entity_id": "person_morelgeorge",
    "entity_type": "Person",
    "created_at": "2026-02-19T07:08:58Z",
    "last_seen_at": "2026-03-03T14:39:44Z",
    "entity_version": "1.0",
    "aliases": []
  },
  {
    "entity_id": "label_kind_provider_microsoft_azure",
    "entity_type": "Label",
    "created_at": "2026-02-19T07:08:58Z",
    "last_seen_at": "2026-03-03T14:39:44Z",
    "entity_version": "1.0",
    "aliases": []
  },
  {
    "entity_id": "issue_62788",
    "entity_type": "Issue",
    "created_at": "2026-03-03T14:02:18Z",
    "last_seen_at": "2026-03-04T18:36:09Z",
    "entity_version": "1.0",
    "aliases": []
  },
  {
    "entity_id": "person_deepak4babu",
    "entity_type": "Person",
    "created_at": "2026-02-13T09:45:23Z",
    "last_seen_at": "2026-03-04T16:31:58Z",
    "entity_version": "1.0",
    "aliases": []
  },
  {
    "entity_id": "issue_62783",
    "entity_type": "Issue",
    "created_at": "2026-03-03T10:54:44Z",
    "last_seen_at": "2026-03-04T16:39:24Z",
    "entity_version": "1.0",
    "aliases": []
  },
  {
    "entity_id": "person_ricardojosepereira",
    "entity_type": "Person",
    "created_at": "2026-03-03T10:54:44Z",
    "last_seen_at": "2026-03-03T10:54:44Z",
    "entity_version": "1.0",
    "aliases": []
  },
  {